{
  "$schema": "../wisp.schema.json",
  "schemaVersion": 1,
  "slug": "heroic",
  "version": "1.0.0",
  "name": "Heroic",
  "description": "t:description",
  "icon": "icon.svg",
  "container": {
    "image": "ghcr.io/wisp-hq/heroic:latest",
    "env": { "TZ": "Europe/Paris" }
  },
  "volumes": [
    {
      "id": "config",
      "label": "t:volumes.config.label",
      "scope": "perUser",
      "hostPath": "heroic",
      "containerPath": "/config",
      "mode": "rw"
    },
    {
      "id": "games",
      "label": "t:volumes.games.label",
      "scope": "shared",
      "hostPath": "/data/shared/heroic-games",
      "containerPath": "/config/Games/Heroic",
      "mode": "rw"
    }
  ]
}
