{
  "$schema": "../app.schema.json",
  "schemaVersion": 1,
  "slug": "rpcs3",
  "version": "1.0.1",
  "name": "RPCS3",
  "description": "t:description",
  "icon": "icon.svg",
  "category": "emulator",
  "container": {
    "image": "ghcr.io/wisp-hq/rpcs3:latest"
  },
  "volumes": [
    {
      "id": "config",
      "label": "t:volumes.config.label",
      "scope": "perUser",
      "hostPath": "rpcs3",
      "containerPath": "/config",
      "mode": "rw"
    },
    {
      "id": "roms",
      "label": "t:volumes.roms.label",
      "scope": "shared",
      "hostPath": "/data/shared/roms",
      "containerPath": "/roms",
      "mode": "ro"
    }
  ],
  "features": {
    "shortcuts": {
      "provider": "library-file",
      "containerPath": "/config/.local/share/wisp/library.json"
    }
  }
}
